{
  "schema_version": 1,
  "spec_version": "0.1.0",
  "checks": {
    "automation_manifest_lints": {
      "description": "AUTOMATION_ORDERS.json exists and passes automation_orders_lint.py.",
      "subject": "project"
    },
    "framework_product_files": {
      "description": "Every file in the exact product manifest exists as a bounded regular file.",
      "subject": "framework"
    },
    "multi_agent_state_files": {
      "description": "PRECEDENTS.md exists for retained recurring multi-agent lessons.",
      "subject": "project"
    },
    "project_contract_sync": {
      "description": "STATEMENT_OF_WORK.md and AGENT_PROJECT.md pass project_contract_sync.py.",
      "subject": "project"
    },
    "project_core_files": {
      "description": "The current-instance receipt, retained input, and generated-state provenance are coherent.",
      "subject": "project"
    },
    "project_entrypoint_resolves": {
      "description": "Generated AGENTS.md or CLAUDE.md resolves the framework charter and project contract.",
      "subject": "project"
    },
    "project_state_files_lint": {
      "description": "Project state files pass project_state_lint.py.",
      "subject": "project"
    },
    "reviewer_lane_feedback_lint": {
      "description": "REVIEWER_LANE_FEEDBACK.md exists and passes lint_reviewer_lane_feedback.py.",
      "subject": "project"
    },
    "security_verification_file": {
      "description": "SECURITY_VERIFICATION.md records scope, profiles, authorization boundaries, and triage sections.",
      "subject": "project"
    },
    "source_freshness_metadata": {
      "description": "SOURCE_PACKS.md and SOURCE_UPDATE.md pass source-freshness checks.",
      "subject": "project"
    }
  },
  "profiles": [
    {
      "description": "The complete installable Master Prompt Agreement product.",
      "id": "framework-product",
      "required_checks": [
        "framework_product_files"
      ],
      "required_directories": [
        "conformance",
        "runtime",
        "scripts",
        "task_orders"
      ],
      "required_files": [
        "AGENTS.md",
        "README.md",
        "SPECIFICATION.md",
        "conformance/profiles.json",
        "conformance/profile.schema.json",
        "scripts/product_manifest.py"
      ],
      "subject": "framework"
    },
    {
      "description": "Generated project instance with its current-format authority, retained input, receipt, and state.",
      "id": "core-project",
      "required_checks": [
        "project_core_files",
        "project_entrypoint_resolves",
        "project_contract_sync",
        "project_state_files_lint"
      ],
      "required_files": [
        "STATEMENT_OF_WORK.md",
        "AGENT_PROJECT.md",
        "TODO.md",
        "DECISIONS.md",
        "PROJECT_INPUT.json",
        "PROJECT_INSTANCE.json"
      ],
      "subject": "project"
    },
    {
      "description": "Generated project that maintains source registries or source-update workflows.",
      "extends": [
        "core-project"
      ],
      "id": "source-managed",
      "required_checks": [
        "source_freshness_metadata"
      ],
      "required_files": [
        "SOURCE_PACKS.md",
        "SOURCE_UPDATE.md"
      ],
      "subject": "project"
    },
    {
      "description": "Generated project that maintains recurring security-verification profiles.",
      "extends": [
        "core-project"
      ],
      "id": "security-managed",
      "required_checks": [
        "security_verification_file"
      ],
      "required_files": [
        "SECURITY_VERIFICATION.md"
      ],
      "subject": "project"
    },
    {
      "description": "Generated project that defines standing automation orders.",
      "extends": [
        "core-project"
      ],
      "id": "automation-managed",
      "required_checks": [
        "automation_manifest_lints"
      ],
      "required_files": [
        "AUTOMATION_ORDERS.json"
      ],
      "subject": "project"
    },
    {
      "description": "Generated project that retains recurring multi-agent lessons and precedents.",
      "extends": [
        "core-project"
      ],
      "id": "multi-agent-managed",
      "required_checks": [
        "multi_agent_state_files"
      ],
      "required_files": [
        "PRECEDENTS.md"
      ],
      "subject": "project"
    },
    {
      "description": "Generated project that records reusable reviewer-lane routing evidence.",
      "extends": [
        "core-project"
      ],
      "id": "reviewer-lane-managed",
      "required_checks": [
        "reviewer_lane_feedback_lint"
      ],
      "required_files": [
        "REVIEWER_LANE_FEEDBACK.md"
      ],
      "subject": "project"
    }
  ]
}
